<?xml version="1.0" encoding="UTF-8"?>
<Certificate xmlns="http://www.cumulus.org/certificate/cert"
 xmlns:xsi="http://www.w3.org/2001/XMLSchema-instance"
 xsi:schemaLocation="http://www.cumulus.org/certificate/cert file:/Users/iridium/Documents/workspace/testManager/XMLRepository/Certificate/certificate.xsd">
    <CertificateId>1414059366167</CertificateId>
    <CertificationModelId>cumulus:cm:id:test:111</CertificationModelId>
    <CertifiedSecurityProperty>CSA:IAM:Account-control:Limitation-of-failed-user-authentication:triggerCount</CertifiedSecurityProperty>
    <CertificateInfo>
        <CertificateType>Test-based</CertificateType>
    </CertificateInfo>
    <CertificationDate>2014-10-23+02:00</CertificationDate>
    <CertificateStatus>not_issued</CertificateStatus>
    <ExpirationDate>2015-10-23T14:34:52.771+02:00</ExpirationDate>
    <Artifacts/>
    <Signature>
        <Name>CumulusCA</Name>
        <Role>TESTER</Role>
    </Signature>
</Certificate>
